{
  "contract_version": "1.0.0",
  "schema_id": "karrierekrake.application_case",
  "id": "case-demo-019",
  "job_id": "job-demo-019",
  "company": "Firma 5",
  "position": "Rolle 19",
  "status": "closed",
  "applied_at": "2026-08-20T10:00:00Z",
  "created_at": "2026-08-20T09:00:00Z",
  "updated_at": "2026-09-20T12:00:00Z",
  "notes": "",
  "contact_email": "hr19@example.com"
}
